{
  "$schema": "https://json-schema.org/draft/2020-12/schema",
  "$id": "https://animation-studio.local/schemas/shot.schema.json",
  "title": "Shot spec",
  "description": "One shot of a film: the source of truth that synfig_mcp turns into scene.sif (D-028). Lives at films/<film>/shots/<id>/shot.json and as an item of the shot list. Times are seconds from the start of the shot. Positions are fractions of the frame: [0, 0] top-left, [1, 1] bottom-right. Rules JSON Schema cannot express (events inside the shot, characters in dialogue present in the shot) are checked by studio_core.schema.check_shot.",
  "type": "object",
  "required": ["id", "duration_s", "background", "characters"],
  "additionalProperties": false,
  "properties": {
    "schema_version": { "const": 1 },
    "id": { "type": "string", "pattern": "^s[0-9]{2}_sh[0-9]{2}$", "description": "Scene and shot number, e.g. 's01_sh03'." },
    "duration_s": { "type": "number", "exclusiveMinimum": 0, "maximum": 60, "description": "Length of the shot in seconds." },
    "background": { "$ref": "#/$defs/id", "description": "Background id (films/<film>/backgrounds/<id>)." },
    "camera": { "$ref": "#/$defs/camera" },
    "characters": {
      "type": "array",
      "maxItems": 4,
      "items": { "$ref": "#/$defs/character" },
      "description": "Characters in the shot, back to front."
    },
    "dialogue": { "type": "array", "items": { "$ref": "#/$defs/line" } },
    "sfx": { "type": "array", "items": { "$ref": "#/$defs/sfx" } },
    "music_cue": {
      "description": "Music cue id (audio/music/<id>.wav), or null for none.",
      "oneOf": [{ "type": "null" }, { "$ref": "#/$defs/id" }]
    },
    "notes": { "type": "string", "maxLength": 1000, "description": "Free text for humans and the director; ignored by tools." }
  },
  "$defs": {
    "id": {
      "type": "string",
      "pattern": "^[a-z][a-z0-9_]{0,39}$",
      "description": "Lowercase identifier: letters, digits, underscores; starts with a letter."
    },
    "time_s": { "type": "number", "minimum": 0, "description": "Seconds from the start of the shot." },
    "frame_pos": {
      "type": "array",
      "description": "[x, y] as fractions of the frame: [0, 0] top-left, [1, 1] bottom-right.",
      "prefixItems": [
        { "type": "number", "minimum": -0.5, "maximum": 1.5 },
        { "type": "number", "minimum": -0.5, "maximum": 1.5 }
      ],
      "items": false,
      "minItems": 2
    },
    "camera": {
      "type": "object",
      "description": "Camera for the whole shot. Omitted = static, zoom 1.",
      "required": ["move"],
      "additionalProperties": false,
      "properties": {
        "move": {
          "enum": ["static", "slow_pan_left", "slow_pan_right", "push_in", "pull_out"],
          "description": "Named camera preset."
        },
        "zoom": { "type": "number", "minimum": 0.5, "maximum": 3, "default": 1, "description": "Starting zoom; 1 = the full frame." },
        "start_s": { "$ref": "#/$defs/time_s" },
        "duration_s": { "type": "number", "exclusiveMinimum": 0, "description": "Defaults to the rest of the shot." }
      }
    },
    "character": {
      "type": "object",
      "required": ["id", "position"],
      "additionalProperties": false,
      "properties": {
        "id": { "$ref": "#/$defs/id", "description": "Character id (characters/<id>/rig.json)." },
        "view": { "enum": ["front", "three_quarter"], "default": "front" },
        "position": { "$ref": "#/$defs/frame_pos", "description": "Where the character stands: the point between its feet (the lowest point of its rest pose), as fractions of the frame. [0.5, 0.92] = centre, standing near the bottom." },
        "scale": { "type": "number", "minimum": 0.2, "maximum": 3, "default": 1, "description": "1 = the rig's natural size." },
        "facing": { "enum": ["left", "right"], "default": "right", "description": "Mirror the character to face left." },
        "actions": { "type": "array", "items": { "$ref": "#/$defs/action" } },
        "expressions": { "type": "array", "items": { "$ref": "#/$defs/expression" } },
        "poses": { "type": "array", "items": { "$ref": "#/$defs/pose" } }
      }
    },
    "action": {
      "type": "object",
      "description": "A named motion from the motion library, starting at start_s.",
      "required": ["motion", "start_s"],
      "additionalProperties": false,
      "properties": {
        "motion": {
          "enum": ["idle_breathe", "blink", "wave", "nod", "head_tilt", "walk_cycle", "jump", "point", "talk_gesture"]
        },
        "start_s": { "$ref": "#/$defs/time_s" },
        "duration_s": { "type": "number", "exclusiveMinimum": 0, "description": "Defaults to the motion's natural length." },
        "params": {
          "type": "object",
          "additionalProperties": false,
          "properties": {
            "energy": { "type": "number", "minimum": 0, "maximum": 1, "default": 0.5, "description": "0 = subtle, 1 = big and fast." },
            "side": { "enum": ["left", "right"], "description": "Which arm/side, from the character's point of view." },
            "cycles": { "type": "integer", "minimum": 1, "maximum": 20, "description": "Repetitions (wave back-and-forths, walk steps)." },
            "target": { "$ref": "#/$defs/frame_pos", "description": "Where to point or look, in the frame." }
          }
        }
      }
    },
    "expression": {
      "type": "object",
      "required": ["expr", "start_s"],
      "additionalProperties": false,
      "properties": {
        "expr": { "enum": ["neutral", "happy", "sad", "surprised", "grumpy", "worried"] },
        "start_s": { "$ref": "#/$defs/time_s" }
      }
    },
    "pose": {
      "type": "object",
      "description": "A manual key pose: bone angle offsets from the rest pose, in degrees.",
      "required": ["time_s", "bones"],
      "additionalProperties": false,
      "properties": {
        "time_s": { "$ref": "#/$defs/time_s" },
        "bones": {
          "type": "object",
          "minProperties": 1,
          "propertyNames": { "$ref": "#/$defs/id" },
          "additionalProperties": { "type": "number", "minimum": -360, "maximum": 360 }
        }
      }
    },
    "line": {
      "type": "object",
      "description": "A dialogue line. Its audio is audio/dialogue/<line_id>.wav, its mouth cues audio/lipsync/<line_id>.json.",
      "required": ["character", "line_id", "text", "start_s"],
      "additionalProperties": false,
      "properties": {
        "character": { "$ref": "#/$defs/id" },
        "line_id": { "type": "string", "pattern": "^l[0-9]{3,}$", "description": "e.g. 'l007'." },
        "text": { "type": "string", "minLength": 1, "maxLength": 300 },
        "start_s": { "$ref": "#/$defs/time_s" }
      }
    },
    "sfx": {
      "type": "object",
      "required": ["query", "start_s"],
      "additionalProperties": false,
      "properties": {
        "query": { "type": "string", "minLength": 2, "maxLength": 100, "description": "What it should sound like; matched against the sound library (Step 3)." },
        "start_s": { "$ref": "#/$defs/time_s" },
        "volume": { "type": "number", "minimum": 0, "maximum": 1, "default": 0.5 }
      }
    }
  }
}
