{
  "schema_version": 1,
  "id": "s01_sh01",
  "duration_s": 10,
  "background": "meadow",
  "camera": { "move": "slow_pan_right", "zoom": 1.0 },
  "characters": [
    {
      "id": "pip",
      "view": "front",
      "position": [0.5, 0.92],
      "scale": 1.0,
      "actions": [
        { "motion": "idle_breathe", "start_s": 0 },
        { "motion": "blink", "start_s": 0, "duration_s": 10 },
        { "motion": "wave", "start_s": 1.0, "params": { "side": "left", "energy": 0.7, "cycles": 3 } }
      ],
      "expressions": [ { "expr": "happy", "start_s": 0 } ]
    }
  ],
  "dialogue": [ { "character": "pip", "line_id": "l001", "text": "Hi Bunny! Look what I found in the tall grass. It's a red kite with a long yellow tail!", "start_s": 1.5 } ],
  "sfx": [ { "query": "soft birdsong", "start_s": 0, "volume": 0.3 } ],
  "music_cue": null
}
